{
  "$id": "https://proofofintent.local/schemas/ExtractIntentResponse.schema.json",
  "$schema": "http://json-schema.org/draft-07/schema#",
  "$ref": "#/definitions/ExtractIntentResponse",
  "definitions": {
    "ExtractIntentResponse": {
      "type": "object",
      "properties": {
        "proposalId": {
          "$ref": "#/definitions/ProposalId"
        },
        "claims": {
          "type": "array",
          "items": {
            "$ref": "#/definitions/IntentClaim"
          }
        },
        "declaredTargets": {
          "type": "array",
          "items": {
            "type": "string"
          },
          "description": "Contract names or addresses the text says it touches."
        },
        "walletMentions": {
          "type": "array",
          "items": {
            "$ref": "#/definitions/WalletMention"
          }
        },
        "model": {
          "type": "string"
        }
      },
      "required": [
        "proposalId",
        "claims",
        "declaredTargets",
        "walletMentions"
      ],
      "additionalProperties": false
    },
    "ProposalId": {
      "type": "string",
      "description": "Meridian Improvement Proposal id.",
      "pattern": "^MIP-[0-9]+$"
    },
    "IntentClaim": {
      "type": "object",
      "properties": {
        "id": {
          "type": "string",
          "description": "Unique within the response, e.g. \"c1\"."
        },
        "category": {
          "$ref": "#/definitions/ClaimCategory"
        },
        "statement": {
          "type": "string",
          "description": "Normalised statement, e.g. \"No change to ownership\"."
        },
        "expectation": {
          "type": "string",
          "enum": [
            "change",
            "no_change"
          ],
          "description": "Whether the text says this thing changes or explicitly stays the same."
        },
        "subject": {
          "type": "string",
          "description": "What the claim is about, e.g. \"MeridianReserve.owner\"."
        },
        "confidence": {
          "$ref": "#/definitions/Probability"
        },
        "citations": {
          "type": "array",
          "items": {
            "$ref": "#/definitions/Citation"
          }
        }
      },
      "required": [
        "id",
        "category",
        "statement",
        "expectation",
        "confidence",
        "citations"
      ],
      "additionalProperties": false,
      "description": "Something the proposal text promises about its own effect."
    },
    "ClaimCategory": {
      "type": "string",
      "enum": [
        "gas",
        "ownership",
        "funds",
        "permissions",
        "upgrade",
        "parameters",
        "other"
      ]
    },
    "Probability": {
      "type": "number",
      "description": "Probability in [0, 1].",
      "minimum": 0,
      "maximum": 1
    },
    "Citation": {
      "type": "object",
      "properties": {
        "documentId": {
          "type": "string",
          "description": "SourceDocument.id the quote comes from."
        },
        "chunkId": {
          "type": "string"
        },
        "quote": {
          "type": "string",
          "description": "Verbatim excerpt supporting the statement."
        },
        "page": {
          "type": "number",
          "description": "1-based page number for PDFs."
        }
      },
      "required": [
        "documentId",
        "quote"
      ],
      "additionalProperties": false
    },
    "WalletMention": {
      "type": "object",
      "properties": {
        "address": {
          "$ref": "#/definitions/Address"
        },
        "documentId": {
          "type": "string"
        },
        "context": {
          "type": "string",
          "description": "Surrounding text, e.g. \"moving ops to my new wallet 0x9f2c...\"."
        }
      },
      "required": [
        "address",
        "documentId",
        "context"
      ],
      "additionalProperties": false,
      "description": "A wallet address mentioned in any source; input to the COI graph."
    },
    "Address": {
      "type": "string",
      "description": "20-byte EVM address, 0x-prefixed (checksum optional).",
      "pattern": "^0x[0-9a-fA-F]{40}$"
    }
  }
}
